{
 "schema_version": "nexloop-api-routes/1",
 "manifest_version": 4,
 "decision": "NX-062 C8-1 (docs/design/c8-route-capability-inventory.md v2, L6 PASS 2026-10-26; dispatcher 2026-10-26): every route nexloop-api mounts in the complete configuration (both browser realms and a built web root, as the stage runs) with its realm and what authorizes it; /openapi.json, /docs and /redoc are not mounted (openapi_url=None, Q-a). Reviewed by hand, never generated in place; a route change edits this file in the same commit and bumps manifest_version. v2 (dispatcher 2026-10-26, F-2 option 1): GET /api/v1/artifacts/{artifact_id}, the test-world service-token read, is mounted in --mode test only; routes without modes are mounted in every mode. v3 (NX-058 slice F): GET /api/v1/workbench/auth/oidc/providers, /oidc/start and /oidc/callback, the workbench single sign-on (pre-session; 404 sso_unavailable while no provider file is configured). v4 (batch 50, NX-043 experiment space slice 1): GET /api/v1/workbench/experiments, the owner's experiments read (port backend.workbench:experiments).",
 "routes": [
  {
   "method": "MOUNT",
   "path": "/",
   "handler": "static",
   "realm": "public_static",
   "authorization": {
    "kind": "static",
    "source": "web_root"
   },
   "purpose": "The built web front end (G-6 checks the build output)",
   "source_task": "NX-028"
  },
  {
   "method": "GET",
   "path": "/api/v1/artifacts/{artifact_id}",
   "handler": "nexloop_eios.http_api:artifact",
   "realm": "service_bearer",
   "authorization": {
    "kind": "service_bearer",
    "world": "test",
    "port": "nexloop_eios.backend.Backend.authenticate"
   },
   "purpose": "S1 HTTP foundation: one Artifact by a Bearer service token of the fixed test world; mounted in --mode test only (F-2)",
   "source_task": "NX-011",
   "modes": [
    "test"
   ]
  },
  {
   "method": "POST",
   "path": "/api/v1/auth/csrf",
   "handler": "nexloop_eios.browser_http:csrf",
   "realm": "pre_session",
   "authorization": {
    "kind": "pre_session",
    "reason": "CSRF token for the next write; no business data"
   },
   "purpose": "Consumer realm: csrf",
   "source_task": "NX-012"
  },
  {
   "method": "POST",
   "path": "/api/v1/auth/login",
   "handler": "nexloop_eios.browser_http:login",
   "realm": "pre_session",
   "authorization": {
    "kind": "pre_session",
    "reason": "Password login; rate limited by account and client (browser_rate_limits); creates the session"
   },
   "purpose": "Consumer realm: login",
   "source_task": "NX-012"
  },
  {
   "method": "POST",
   "path": "/api/v1/auth/logout",
   "handler": "nexloop_eios.browser_http:logout",
   "realm": "consumer_session",
   "authorization": {
    "kind": "session_only",
    "reason": "Ends the caller's own session"
   },
   "purpose": "Consumer realm: logout",
   "source_task": "NX-012"
  },
  {
   "method": "GET",
   "path": "/api/v1/auth/session",
   "handler": "nexloop_eios.browser_http:session",
   "realm": "consumer_session",
   "authorization": {
    "kind": "session_only",
    "reason": "The caller's own session view"
   },
   "purpose": "Consumer realm: session",
   "source_task": "NX-012"
  },
  {
   "method": "GET",
   "path": "/api/v1/commercial-observations",
   "handler": "nexloop_eios.commercial_observe_http:records",
   "realm": "consumer_session",
   "authorization": {
    "kind": "port",
    "port": "nexloop_eios.commercial.CommercialObserver.records"
   },
   "purpose": "Commercial records (NX-027, human read)",
   "source_task": "NX-027"
  },
  {
   "method": "GET",
   "path": "/api/v1/commercial-observations/{record_id}",
   "handler": "nexloop_eios.commercial_observe_http:record",
   "realm": "consumer_session",
   "authorization": {
    "kind": "port",
    "port": "nexloop_eios.commercial.CommercialObserver.record"
   },
   "purpose": "One commercial record (NX-027, human read)",
   "source_task": "NX-027"
  },
  {
   "method": "GET",
   "path": "/api/v1/context/manifests/{run_id}/{call_sequence}",
   "handler": "nexloop_eios.context_audit_http:manifest",
   "realm": "consumer_session",
   "authorization": {
    "kind": "port",
    "port": "nexloop_eios.context_audit_http.ContextAuditPorts.manifest"
   },
   "purpose": "Context Manifest of one Run call (NX-023, human only)",
   "source_task": "NX-023"
  },
  {
   "method": "GET",
   "path": "/api/v1/conversations",
   "handler": "nexloop_eios.web_chat_http:conversations",
   "realm": "consumer_session",
   "authorization": {
    "kind": "port",
    "port": "backend.browser:list_conversations"
   },
   "purpose": "The consumer's own conversations",
   "source_task": "NX-012"
  },
  {
   "method": "POST",
   "path": "/api/v1/conversations",
   "handler": "nexloop_eios.web_chat_http:create",
   "realm": "consumer_session",
   "authorization": {
    "kind": "port",
    "port": "backend.browser:create_conversation"
   },
   "purpose": "Create a conversation (governed Conversation Action)",
   "source_task": "NX-012"
  },
  {
   "method": "GET",
   "path": "/api/v1/conversations/{conversation_id}/events",
   "handler": "nexloop_eios.web_chat_http:events",
   "realm": "consumer_session",
   "authorization": {
    "kind": "port",
    "port": "backend.browser:read_events"
   },
   "purpose": "Conversation events (SSE)",
   "source_task": "NX-012"
  },
  {
   "method": "GET",
   "path": "/api/v1/conversations/{conversation_id}/handling",
   "handler": "nexloop_eios.conversation_takeover_http:handling",
   "realm": "consumer_session",
   "authorization": {
    "kind": "port",
    "port": "sql:authz.nexloop_conversation_takeover_state"
   },
   "purpose": "Whether a person handles this conversation (NX-028 D4)",
   "source_task": "NX-028"
  },
  {
   "method": "GET",
   "path": "/api/v1/conversations/{conversation_id}/messages",
   "handler": "nexloop_eios.web_chat_http:messages",
   "realm": "consumer_session",
   "authorization": {
    "kind": "port",
    "port": "backend.browser:read_messages"
   },
   "purpose": "Conversation messages",
   "source_task": "NX-012"
  },
  {
   "method": "POST",
   "path": "/api/v1/conversations/{conversation_id}/messages",
   "handler": "nexloop_eios.web_chat_http:send",
   "realm": "consumer_session",
   "authorization": {
    "kind": "port",
    "port": "backend.browser:accept_message"
   },
   "purpose": "Send a message (governed Conversation Action)",
   "source_task": "NX-012"
  },
  {
   "method": "POST",
   "path": "/api/v1/conversations/{conversation_id}/native-messages",
   "handler": "nexloop_eios.web_chat_http:native_send",
   "realm": "consumer_session",
   "authorization": {
    "kind": "port",
    "port": "backend.browser:accept_native_message"
   },
   "purpose": "Native WebChat inbound message",
   "source_task": "NX-037"
  },
  {
   "method": "GET",
   "path": "/api/v1/costs",
   "handler": "nexloop_eios.commercial_observe_http:costs",
   "realm": "consumer_session",
   "authorization": {
    "kind": "port",
    "port": "nexloop_eios.commercial.CommercialObserver.costs"
   },
   "purpose": "Cost summary and settlements (NX-027, human read)",
   "source_task": "NX-027"
  },
  {
   "method": "GET",
   "path": "/api/v1/costs/entries",
   "handler": "nexloop_eios.commercial_observe_http:entries",
   "realm": "consumer_session",
   "authorization": {
    "kind": "port",
    "port": "nexloop_eios.commercial.CommercialObserver.cost_entries"
   },
   "purpose": "Cost entries (NX-027, human read)",
   "source_task": "NX-027"
  },
  {
   "method": "GET",
   "path": "/api/v1/messages/{message_id}/receipt",
   "handler": "nexloop_eios.web_chat_http:message_receipt",
   "realm": "consumer_session",
   "authorization": {
    "kind": "port",
    "port": "backend.browser:read_message_service_receipt"
   },
   "purpose": "Service receipt of one message",
   "source_task": "NX-037"
  },
  {
   "method": "GET",
   "path": "/api/v1/messages/{message_id}/run",
   "handler": "nexloop_eios.web_chat_http:message_run",
   "realm": "consumer_session",
   "authorization": {
    "kind": "port",
    "port": "backend.browser:read_message_run"
   },
   "purpose": "Run state of one message",
   "source_task": "NX-014"
  },
  {
   "method": "GET",
   "path": "/api/v1/messages/{message_id}/scope-denial",
   "handler": "nexloop_eios.web_chat_http:scope_denial",
   "realm": "consumer_session",
   "authorization": {
    "kind": "port",
    "port": "backend.browser:read_message_scope_denial"
   },
   "purpose": "Scope denial of one message",
   "source_task": "NX-014"
  },
  {
   "method": "GET",
   "path": "/api/v1/metrics/{goal_id}/{goal_version}/{kr_key}",
   "handler": "nexloop_eios.commercial_observe_http:metric",
   "realm": "consumer_session",
   "authorization": {
    "kind": "port",
    "port": "nexloop_eios.commercial.CommercialObserver.metric"
   },
   "purpose": "One key result value (NX-027, human read)",
   "source_task": "NX-027"
  },
  {
   "method": "GET",
   "path": "/api/v1/review/awaiting",
   "handler": "nexloop_eios.review_http:awaiting",
   "realm": "consumer_session",
   "authorization": {
    "kind": "port",
    "port": "nexloop_eios.review_actions.ReviewWorkbenchPorts.review_awaiting"
   },
   "purpose": "Review decisions awaiting (NX-044)",
   "source_task": "NX-044"
  },
  {
   "method": "GET",
   "path": "/api/v1/review/candidates/{candidate_id}",
   "handler": "nexloop_eios.review_http:candidate",
   "realm": "consumer_session",
   "authorization": {
    "kind": "port",
    "port": "nexloop_eios.review_actions.ReviewWorkbenchPorts.review_candidate"
   },
   "purpose": "One review candidate (NX-046)",
   "source_task": "NX-046"
  },
  {
   "method": "POST",
   "path": "/api/v1/review/candidates/{candidate_id}/decisions",
   "handler": "nexloop_eios.review_http:decide",
   "realm": "consumer_session",
   "authorization": {
    "kind": "port",
    "port": "nexloop_eios.review_actions.ReviewWorkbenchPorts.decide"
   },
   "purpose": "Governed human review decision (NX-044)",